{
  "schema_version": "1.0.0",
  "event_id": "55555555-5555-4555-8555-555555555555",
  "event_type": "network_connection_observed",
  "target_id": "22222222-2222-4222-8222-222222222222",
  "agent_id": "33333333-3333-4333-8333-333333333333",
  "boot_id": "44444444-4444-4444-8444-444444444444",
  "sequence": 3,
  "observed_at": "2026-09-29T17:34:06.250000Z",
  "basis": "procfs_poll",
  "content_class": "observation",
  "payload": {
    "protocol": "tcp",
    "local_port": 40000,
    "remote_port": 443,
    "remote_address": "[ip]",
    "uid": 1000,
    "pid": 4242
  }
}
