{
  "schema_version": "1.0.0",
  "event_id": "11111111-1111-4111-8111-111111111111",
  "event_type": "process_started",
  "target_id": "22222222-2222-4222-8222-222222222222",
  "agent_id": "33333333-3333-4333-8333-333333333333",
  "boot_id": "44444444-4444-4444-8444-444444444444",
  "sequence": 1,
  "observed_at": "2026-09-29T17:34:00.000000Z",
  "basis": "procfs_poll",
  "content_class": "observation",
  "payload": {
    "pid": 4242,
    "ppid": 1,
    "uid": 1000,
    "start_ticks": 123456,
    "comm": "aaaaaaaaaaaaaaaa"
  }
}
